title,updateTimestamp,content,relatedStocks,relatedInfos,date,trade_date
机构：特朗普就职和首日命令可能构成重大风险，澳元或将大幅波动,2025-01-20 14:45:13,格隆汇1月20日｜西太平洋银行外汇策略主管ichard Franulovich表示，本周经济数据日程较少，但围绕特朗普的就职典礼和上任第一天可能发布一连串行政命令存在重大事件风险。Franulovich认为本周澳元/美元的潜在波动区间非常大，该货币对可能在0.6050至0.6300之间波动。不过，特朗普就职演说实际上并不是谈论关税的场合，他甚至可能不会明确提出关税问题，这与他2017年的就职演说一样。这不是外汇市场寻求政策细节的场合。,AUD,,2025-01-20 06:45:13,20250121
美元指数跌破108 非美货币继续走高,2025-01-20 22:45:24,"格隆汇1月20日｜美元指数跌破108，日内跌1.30%。非美货币继续走高，美元兑日元USD/JPY日内跌超0.50%，现报155.48。美元兑加元USD/CAD失守1.43，日内跌幅1.27%。欧元兑美元EUR/USD和澳元兑美元AUD/USD日内涨幅均扩大至1.50%。
特朗普的官员证实了华尔街日报的报道，即他在上任第一天不会实施新关税。",AUD,['美元'],2025-01-20 14:45:24,20250121
美元指数大跌超1.2%，非美货币普遍走高,2025-01-21 06:21:18,格隆汇1月21日｜周一（1月20日）纽约尾盘，ICE美元指数下跌1.26%，报107.970点。彭博美元指数跌1.11%，报1301.60点。美元兑日元下跌0.49%，报155.53日元。欧元兑日元涨0.98%，报162.12日元；英镑兑日元涨0.88%，报191.873日元。欧元兑美元涨1.45%、报1.0434，英镑兑美元涨1.34%、报1.2332，美元兑瑞郎跌0.93%报0.9065，澳元兑美元涨1.33%，纽元兑美元涨1.64%，美元兑加元跌1.23%。瑞典克朗兑美元涨1.58%，挪威克朗兑美元涨1.37%。,AUD,,2025-01-20 22:21:18,20250121
澳元和新西兰元创两周高位，因特朗普没有宣布新关税,2025-01-21 08:41:03,格隆汇1月21日｜澳元和新西兰元周二位于两周高点附近，美国总统特朗普在上任首日没有宣布征收新的关税，引发了美元普遍下跌。澳元兑美元上涨 0.1%，至 0.6282 美元，隔夜曾反弹 1.4% 至两周高点 0.6287 美元。这波反弹可能使澳元在短期内免于测试五年新低，目前阻力位在 0.6302 美元。新西兰元也创两周新高 0.5683 美元，隔夜上涨了1.6%。阻力位在 0.5692 美元，支撑位在 0.5539 美元。在更广泛的市场上，美元在特朗普就职演说后大跌。特朗普就职演说中宣布了移民和能源紧急措施，但仅简短地提到了关税问题。到目前为止，还没有关于如何或何时推出新关税的细节。,AUD,,2025-01-21 00:41:03,20250121
