title,updateTimestamp,content,relatedStocks,relatedInfos,date,trade_date
,2024-08-14 09:16:21,格隆汇8月14日｜人民币兑美元中间价较上日调升64点至7.1415，升幅创2024年5月6日以来最大。,CNH,,2024-08-14 01:16:21,20240815
业内人士：人民币汇率将在合理均衡水平上继续保持基本稳定,2024-08-14 09:57:02,格隆汇8月14日｜据金融时报，近期，在岸和离岸人民币对美元汇率均升破7.2，8月1日至12日累计涨幅分别为0.6%和0.7%。这轮人民币对美元汇率交易价反弹，引发市场热议。对于这波走强行情，业内专家表示，当前发达经济体政策外溢影响减弱。“近年来，高美元利率和强美元指数对全球产生明显的外溢性影响。”该专家认为，2022年以来，美国政策利率累计上调525个基点达到5.25%至5.5%，处于历史高位，目前，美元指数在103附近，位于近年高点。受此影响，今年以来，非美货币普遍贬值，但人民币对美元汇率仅贬值1.3%，幅度小于多数主要货币，相较而言是比较稳定的。展望后市，业内人士认为，人民币汇率将在合理均衡水平上继续保持基本稳定。,CNH,,2024-08-14 01:57:02,20240815
,2024-08-14 16:31:23,格隆汇8月14日｜在岸人民币兑美元北京时间16:30官方收报7.1484，较上一交易日官方收盘价涨210点，较上日夜盘收盘涨58点。,CNH,,2024-08-14 08:31:23,20240815
,2024-08-15 06:19:07,格隆汇8月15日｜在岸人民币兑美元北京时间03:00收报7.1400，较上一交易日夜盘收盘涨142点。成交量420.05亿美元。,CNH,,2024-08-14 22:19:07,20240815
,2024-08-15 06:35:14,格隆汇8月15日｜离岸人民币（CNH）兑美元北京时间04:59报7.1471元，较周二纽约尾盘涨8点，盘中整体交投于7.1536-7.1309元区间。,CNH,,2024-08-14 22:35:14,20240815
