title,updateTimestamp,content,relatedStocks,relatedInfos,date,trade_date
,2024-11-21 09:00:24,格隆汇11月21日｜中国10月Swift人民币在全球支付中占比2.93%，前值3.61%。,CNH,,2024-11-21 01:00:24,20241122
人民币兑美元中间价报7.1934 上调1点,2024-11-21 09:16:57,格隆汇11月21日｜人民币兑美元中间价报7.1934，上调1点；上一交易日中间价7.1935，上一交易日官方收盘价7.2422，上日夜盘报收7.2455。,CNH,,2024-11-21 01:16:57,20241122
,2024-11-21 16:34:45,格隆汇11月21日｜在岸人民币兑美元11月21日16:30收盘报7.2410，较上一交易日上涨12点。,CNH,,2024-11-21 08:34:45,20241122
商务部：保持人民币汇率在合理均衡水平上的基本稳定,2024-11-21 17:05:01,格隆汇11月21日｜商务部印发促进外贸稳定增长若干政策措施的通知。通知指出，优化跨境贸易结算。引导银行机构优化海外布局，提升对企业开拓国际市场的服务保障能力。加强宏观政策协调配合，保持人民币汇率在合理均衡水平上的基本稳定。鼓励金融机构为外贸企业提供更多汇率风险管理产品，帮助企业提升汇率风险管理水平。,CNH,,2024-11-21 09:05:01,20241122
,2024-11-22 06:20:33,格隆汇11月22日｜在岸人民币兑美元（CNY）北京时间03:00收报7.2418元，较周三夜盘收盘涨37点。成交量450.65亿美元。,CNH,,2024-11-21 22:20:33,20241122
,2024-11-22 06:25:25,格隆汇11月22日｜离岸人民币（CNH）兑美元北京时间05:59报7.2550元，较周三纽约尾盘跌39点，日内整体交投于7.2402-7.2598元区间。,CNH,,2024-11-21 22:25:25,20241122
