title,updateTimestamp,content,relatedStocks,relatedInfos,date,trade_date
人民币兑美元中间价报7.0709 下调635点,2024-10-08 09:16:22,格隆汇10月8日｜人民币兑美元中间价较上日调降635点至7.0709，降幅创2022年5月6日以来最大。,CNH,,2024-10-08 01:16:22,20241009
CNH HIBOR主要期限利率涨跌不一,2024-10-08 11:54:58,格隆汇10月8日｜隔夜HIBOR涨81个基点至2.11909%，创9月30日以来新高；一周期HIBOR微跌至2.42864%；两周期HIBOR下探至2.44848%；一年期HIBOR小跌至2.35258%。,CNH,,2024-10-08 03:54:58,20241009
大摩：若特朗普胜出大选，人民币料跌至7.35,2024-10-08 13:25:33,"格隆汇10月8日｜距离美国大选投票日已不足1个月，摩根士丹利表示，如果共和党总统候选人特朗普胜选，预料人民币兑美元将跌至7.35元。
摩根士丹利亚洲宏观战略主管在报告指出，如果美国大选的最终结果不改变目前中美贸易格局，中国出口商结汇可能会继续增加，并推动人民币于今年底或明年初继续涨至6.9元。目前，中国外汇市场供求整体上更为平衡，预计人民币汇率在美国大选前将保持横盘整理。
报告称，如果中国出口商结汇增加，中国国有银行可能继续对其在此前一年间积累的大量掉期头寸进行平仓，从而抵消结汇给人民币带来的升值动力。考虑到后期美国经济数据和中国刺激政策所面临的不确定性，以及美国大选结果可能带来两极分化的影响，建议投资者建立期权组合，以对人民币大幅升值或贬值的情形提前布局。",CNH,,2024-10-08 05:25:33,20241009
,2024-10-08 16:36:11,格隆汇10月8日｜在岸人民币兑美元10月8日16:30收盘报7.0535，较上一交易日下跌379点。,CNH,,2024-10-08 08:36:11,20241009
在岸人民币兑美元周二跌433点,2024-10-09 06:18:00,格隆汇10月9日｜在岸人民币兑美元北京时间03:00收报7.0648，较上一交易日夜盘收盘跌433点，成交量436.19亿美元。,CNH,,2024-10-08 22:18:00,20241009
,2024-10-09 06:25:46,格隆汇10月9日｜离岸人民币（CNH）兑美元北京时间04:59报7.0738元，较周一纽约尾盘跌25点，盘中整体交投于7.0845-7.0464元区间。,CNH,,2024-10-08 22:25:46,20241009
