title,updateTimestamp,content,relatedStocks,relatedInfos,date,trade_date
人民币兑美元中间价报7.1876 下调22点,2024-12-13 09:16:26,格隆汇12月13日｜人民币兑美元中间价报7.1876，下调22点；上一交易日中间价7.1854，上一交易日官方收盘价7.2630，上日夜盘报收7.2700。,CNH,,2024-12-13 01:16:26,20241214
CNH HIBOR主要期限利率全线反弹,2024-12-13 11:32:17,格隆汇12月13日｜隔夜HIBOR大涨218个基点至5.53212%，创11月19日以来新高。另外香港金管局200亿元人民币的日间回购协议流动性已被用逾八成。一周期的HIBOR涨102个基点至4.79773%，两周期HIBOR升63个基点至4.31030%，均触及11月20日以来高点；一年期HIBOR升11个基点至2.91364%，创11月19日以来新高。,CNH,,2024-12-13 03:32:17,20241214
央行：明年还将深化汇率市场化改革 加强汇率预期管理,2024-12-13 16:44:04,格隆汇12月13日｜据央视，中国人民银行货币政策司有关负责人表示，作为金融管理部门，人民银行将聚焦服务高质量发展这一首要任务，持续营造良好的货币金融环境，强化与其他宏观政策的合力，促进经济可持续发展。央行表示，明年将推动社会综合融资成本稳中有降，创造有利的利率环境，支持扩消费、促投资。发挥行业自律作用，维护存贷款市场竞争秩序，稳定银行负债成本，提升银行自主理性定价能力。此外，明年还将深化汇率市场化改革，加强汇率预期管理，有力应对外部冲击，坚决防范汇率超调风险，保持人民币汇率在合理均衡水平上的基本稳定。人民银行还将按照中央经济工作会议提出的要求，提高政策整体效能。,CNH,,2024-12-13 08:44:04,20241214
,2024-12-14 06:14:51,格隆汇12月14日｜在岸人民币兑美元（CNY）北京时间03:00收报7.2731元，较周四夜盘收盘跌31点。成交量367.81亿美元。,CNH,,2024-12-13 22:14:51,20241214
,2024-12-14 06:45:17,格隆汇12月14日｜离岸人民币（CNH）兑美元北京时间05:59报7.2811元，较周四纽约尾盘跌52点，日内整体交投于7.2746-7.2925元区间。,CNH,,2024-12-13 22:45:17,20241214
