title,updateTimestamp,content,relatedStocks,relatedInfos,date,trade_date
人民币兑美元中间价报7.0531 上调113点,2024-09-23 09:15:19,格隆汇9月23日丨人民币兑美元中间价报7.0531，上调113点；上一交易日中间价7.0644，上一交易日官方收盘价7.0552，上日夜盘报收7.0480。,CNH,,2024-09-23 01:15:19,20240924
经济学家：人民币兑美元的升值会破7，建议10年发50万亿超长期特别国债,2024-09-23 13:23:01,"格隆汇9月23日｜据六里投资报，近日中泰证券首席经济学家李迅雷表示，最近人民币又开始升值，最低时是1：7.3，现在已升至7.05。预计这轮人民币兑美元的升值会突破7，可能达到6.9或6.8。这是因为美联储在时隔四年后降息，这一轮美联储的降息估计会持续到2026年。
李迅雷建议，应对当前的困局，政府要加杠杆，并且是中央政府加杠杆，每年发5万亿，10年发50万亿超长期特别国债；多发国债，没有后果，只有好处；要增加政府的有形之手，加大力度。
针对目前市场环境，李迅雷在今年初就曾建议要重配两类资产，一类是黄金，一类是国债，一直到现在也不认为黄金已到顶。",CNH,,2024-09-23 05:23:01,20240924
,2024-09-23 16:33:14,格隆汇9月23日｜在岸人民币兑美元9月23日16:30收盘报7.0587，较上一交易日下跌35点。,CNH,,2024-09-23 08:33:14,20240924
,2024-09-24 06:17:26,格隆汇9月24日｜在岸人民币兑美元北京时间03:00收报7.0525，较上一交易日夜盘收盘跌45点。成交量416.20亿美元。,CNH,,2024-09-23 22:17:26,20240924
,2024-09-24 06:20:35,格隆汇9月24日｜离岸人民币（CNH）兑美元北京时间04:59报7.0604元，较上周五纽约尾盘跌183点，盘中整体交投于7.0400-7.0650元区间。,CNH,,2024-09-23 22:20:35,20240924
