title,updateTimestamp,content,relatedStocks,relatedInfos,date,trade_date
人民币兑美元中间价较上日调升88点至7.1894,2024-11-28 09:15:34,格隆汇11月28日｜人民币兑美元中间价报7.1894，上调88点；上一交易日中间价7.1982，上一交易日官方收盘价7.2487，上日夜盘报收7.2470。,CNH,,2024-11-28 01:15:34,20241129
CNH HIBOR主要期限利率涨跌不一,2024-11-28 11:33:32,格隆汇11月28日｜两周期HIBOR跌至2.93455%，至11月11日以来低点。隔夜HIBOR则涨9个基点至1.35000%，脱离逾两个月低点；一周期的HIBOR涨43个基点至2.40909%，一年期HIBOR小涨至2.86515%。,CNH,,2024-11-28 03:33:32,20241129
,2024-11-28 16:35:20,格隆汇11月28日｜在岸人民币对美元16:30收盘报7.2525，较上一交易日跌38个基点。,CNH,,2024-11-28 08:35:20,20241129
,2024-11-29 06:19:53,格隆汇11月29日｜在岸人民币兑美元（CNY）北京时间03:00收报7.2450元，较周三夜盘收盘涨20点。成交量265.80亿美元。,CNH,,2024-11-28 22:19:53,20241129
,2024-11-29 06:22:58,格隆汇11月29日｜离岸人民币（CNH）兑美元北京时间05:59报7.2499元，较周三纽约尾盘跌50点，日内整体交投于7.2413-7.2597元区间。,CNH,,2024-11-28 22:22:58,20241129
