title,updateTimestamp,content,relatedStocks,relatedInfos,date,trade_date
人民币兑美元中间价报7.1705 上调3点,2025-01-24 09:16:14,格隆汇1月24日｜人民币兑美元中间价报7.1705，上调3点；上一交易日中间价7.1708，上一交易日官方收盘价7.2874，上日夜盘报收7.2846。,CNH,,2025-01-24 01:16:14,20250125
离岸人民币兑美元升超200点,2025-01-24 10:19:16,格隆汇1月24日｜离岸人民币兑美元短线走高，升超200点，最高触及7.2622。受特朗普有关关税的言论推动，澳元、纽元兑美元也涨超0.4%。,CNH,,2025-01-24 02:19:16,20250125
离岸人民币兑美元逼近7.25关口，在岸升破7.25关口 ,2025-01-24 11:00:41,格隆汇1月24日｜离岸人民币兑美元持续走高，日内涨超350点，升幅0.5%，逼近7.25关口。在岸人民币兑美元涨0.5%，至7.2474。,CNH,,2025-01-24 03:00:41,20250125
在岸人民币兑美元创去年11月末以来新高,2025-01-24 16:31:42,格隆汇1月24日｜在岸人民币兑美元收盘报7.2412，创2024年11月29日以来新高，较上一交易日上涨462点。,CNH,,2025-01-24 08:31:42,20250125
外汇局：2024年12月中国外汇市场总计成交26.69万亿元人民币,2025-01-24 19:34:57,格隆汇1月24日｜国家外汇管理局统计数据显示，2024年12月，中国外汇市场(不含外币对市场)总计成交26.69万亿元人民币(等值3.71万亿美元)。2024年1-12月，中国外汇市场累计成交293.01万亿元人民币(等值41.14万亿美元)。,CNH,['外汇动态'],2025-01-24 11:34:57,20250125
离岸空头继续踩踏，专家称人民币迈向7.2？,2025-01-24 20:13:48,"格隆汇1月24日｜据一财，今日人民币突然大涨近400点。近期，人民币的走势与预期的南辕北辙。在美国总统特朗普正式就任后，人民币势如破竹，截至北京时间1月24日16:30，美元/离岸人民币报7.2432，当日累计大涨近400点。相较于1月的7.37附近的最弱位置，已经累计大涨近1300点。
“此前市场的关税预期太高、贬值预期太满、美元人民币多头太拥挤。”外汇专家、浙商中拓集团金融市场业务部总经理刘杨表示，“有交易员认为，今天只是砍盘，7.24还是会有美元做多头寸，今天人民币也的确在7.24这个位置止住了升势，所以确实是有美元买盘。不过我认为，只要中美关系阶段性改善的主题不变，人民币升值就不算完，暂时可以先看7.2，因为这是关键的技术点位，刚好在200日均线和120日均线之间。”",CNH,['外汇动态'],2025-01-24 12:13:48,20250125
人民币汇率强势拉升！专家：保持稳定有基础,2025-01-24 20:41:45,"格隆汇1月24日｜据中证金牛座，人民币对美元汇率涨势迅猛，盘中收复7.24元关口。“人民币汇率大涨主要受消息面影响。”国家金融与发展实验室特聘高级研究员庞溟表示，市场普遍憧憬外部环境不确定性减少，这使人民币汇率在情绪和基本面上均受到支持。稳汇率的关键在于稳经济。
中银证券全球首席经济学家管涛表示，稳汇率更多是为国内经济调整争取时间。同时，人民银行多年来在应对外部冲击中积累了丰富的经验。因此，人民币汇率有条件保持基本稳定。
展望2025年，中国工商银行(亚洲)东南亚研究中心报告认为，中国商品竞争力持续提升提供出口增长韧性，内需支持性政策持续落地显效，叠加创新性资本市场政策工具逐步常态化、人民币金融资产估值偏低等因素共同提振，人民币汇率双向波动仍是常态。",CNH,['外汇动态'],2025-01-24 12:41:45,20250125
在岸人民币兑美元大涨466点,2025-01-25 06:21:28,格隆汇1月25日｜在岸人民币兑美元（CNY）北京时间03:00收报7.2380元，较周四夜盘收盘涨466点。成交量597.72亿美元。,CNH,,2025-01-24 22:21:28,20250125
离岸人民币兑美元大涨434点,2025-01-25 06:41:35,格隆汇1月25日｜离岸人民币（CNH）兑美元北京时间05:59报7.2443元，较周四纽约尾盘涨434点，日内整体交投于7.2881-7.2346元区间。,CNH,,2025-01-24 22:41:35,20250125
