title,updateTimestamp,content,relatedStocks,relatedInfos,date,trade_date
人民币兑美元中间价报7.1030 上调184点,2024-09-13 09:15:41,格隆汇9月13日｜人民币兑美元中间价较上日调升184点至7.1030，上一交易日中间价7.1214，上一交易日官方收盘价7.1236，上日夜盘报收7.1173。,CNH,,2024-09-13 01:15:41,20240914
洪灏：美国降息后资本回流中国是大概率事件，海外至少有四五千亿美元可回流中国,2024-09-13 10:22:33,"格隆汇9月13日｜美联储本月中议息，思睿首席经济学家洪灏表示，美联储大概率是要降息的，接下来需关注降息幅度(降25个点还是50个点)，而美联储减息后，中国央行会如何行动，以及出口商如何结汇。他提到，对于很多出口商来说，大概率事件——资本会开始回流到中国。他指出现在整个回报预期和资本流向很可能都会发生变化，那么资金开始回流，海外至少都有四五千亿的美元可以回流到中国市场，这对人民币升值的推动力非常大。
洪灏指出，人民币升值利好港股，因港股是美元计价的人民币资产。这波行情中，港股表现略好于A股。由于估值低，对人民币预期的改变，科技股反弹力度更大。房地产板块也因转按揭传言受提振。",CNH,,2024-09-13 02:22:33,20240914
对冲基金据报押注日元进一步升值,2024-09-13 13:20:44,"格隆汇9月13日｜据彭博，一些对冲基金在选择权市场上增加看涨日元的押注，他们预期日元将延续升势。一位交易员称，对冲基金对日元兑澳元、瑞士法郎和离岸人民币等货币持有多头头寸。
迹象显示，日本央行有意进一步加息，助日元兑美元自6月底以来上升约14%。美联储可能减息及日元空头部位的迅速平仓也有助于此。
继美联储可能在下周周中减息后，日本央行将在下周五发布政策决定。日本央行一些审议委员的最新评论显示，在7月政策利率上调至0.25%后，日本未来仍可能升息。
荷兰合作银行驻伦敦外滙策略主管Jane Foley表示，假设日本央行不排除年底左右再次加息的可能性，美元兑日元在未来3-6个月将继续向140移动。其他策略师预计，美元兑日元汇率到年底仍将下跌，甚至可能触及135。",CNH,,2024-09-13 05:20:44,20240914
,2024-09-13 16:32:03,格隆汇9月13日丨在岸人民币兑美元9月13日16:30收盘报7.0943，较上一交易日上涨293点。,CNH,,2024-09-13 08:32:03,20240914
,2024-09-14 06:16:19,格隆汇9月14日｜在岸人民币兑美元（CNY）北京时间03:00收报7.0958元，较周四夜盘收盘涨215点。成交量349.79亿美元。,CNH,,2024-09-13 22:16:19,20240914
,2024-09-14 06:21:04,格隆汇9月14日｜离岸人民币（CNH）兑美元北京时间04:59报7.1004元，较周四纽约尾盘涨186点，本周整体交投于7.1367-7.0845元区间、呈现出冲高回落走势。,CNH,,2024-09-13 22:21:04,20240914
