title,updateTimestamp,content,relatedStocks,relatedInfos,date,trade_date
人民币兑美元中间价报7.0731 上调11点,2024-10-11 09:16:21,格隆汇10月11日｜人民币兑美元中间价报7.0731，上调11点；上一交易日中间价7.0742，上一交易日官方收盘价7.0787，上日夜盘报收7.0768。,CNH,,2024-10-11 01:16:21,20241012
,2024-10-11 16:36:08,格隆汇10月11日｜在岸人民币兑美元16:30收盘报7.0676，较上一交易日涨111个基点。,CNH,,2024-10-11 08:36:08,20241012
证监会等部门：提高金融期货和衍生品市场发展水平，支持各类中长期资金开展金融期货和衍生品套期保值交易,2024-10-11 17:12:48,格隆汇10月11日｜中国证监会、国家发展改革委、工业和信息化部、农业农村部、商务部、中国人民银行、金融监管总局发布《关于加强监管防范风险促进期货市场高质量发展的意见》。其中提出，提高金融期货和衍生品市场发展水平。发挥股指期货期权稳定市场、活跃市场的双重功能，丰富交易品种，扩大市场覆盖面，提高交易便利性，加强期现货市场协同联动，助力增强股票市场内在稳定性。在国债期货跨部委协调机制下，稳妥有序推动商业银行参与国债期货交易试点。支持各类中长期资金开展金融期货和衍生品套期保值交易。,CNH,,2024-10-11 09:12:48,20241012
,2024-10-12 06:15:30,格隆汇10月12日｜在岸人民币兑美元北京时间03:00收报7.0669，较上一交易日夜盘收盘涨99点。成交量331.03亿美元。,CNH,,2024-10-11 22:15:30,20241012
离岸人民币周五涨138点至7.0711元,2024-10-12 06:26:57,格隆汇10月12日｜离岸人民币（CNH）兑美元北京时间04:59报7.0711元，较周四纽约尾盘涨138点，盘中整体交投于7.0888-7.0663元区间。本周，离岸人民币累计上涨大约266点，10月8日一度涨至7.0464元。,CNH,,2024-10-11 22:26:57,20241012
