title,updateTimestamp,content,relatedStocks,relatedInfos,date,trade_date
,2024-11-11 10:24:53,格隆汇11月11日｜摩根大通策略师预计，如果共和党横扫美国参众两院，欧元兑美元将跌至1.00-1.02美元，较当前水平下跌约6%，而如果国会出现分治，欧元兑美元将跌至1.05美元。,EUR,,2024-11-11 02:24:53,20241112
荷兰国际：欧美短期利差仍然悬殊 欧元短期料难以回升,2024-11-11 17:30:09,格隆汇11月11日｜荷兰国际集团表示，欧元兑美元汇率跌至四个半月来的低点，随着利差对汇率的影响，欧元可能难以回升。荷兰国际集团分析师Chris Turner在一份报告中表示，欧元区与美国的短期利差仍然 “异常悬殊”，对美元有利。他表示，欧洲央行将需要通过进一步降息来支持欧元区经济，因为德国财政状况在德国联邦选举前似乎不太可能彻底好转。荷兰国际集团预计欧洲央行将在12月降息50个基点。Turner表示，只有头寸调整才可能在本周推动欧元走强，但任何涨幅都是有限的。,EUR,,2024-11-11 09:30:09,20241112
机构：冬季来临，欧洲天然气价格上涨,2024-11-11 17:49:23,格隆汇11月11日｜随着冬季的到来，欧洲天然气储量的消耗增加，天然气价格有所上涨。周一基准的荷兰TTF天然气期货合约一度涨2.4%，至每兆瓦时43.40欧元。澳新银行分析师在给客户的一份报告中表示：“市场正在关注天气预报，这些天气预报显示，未来几周欧洲的气温将会更低。”根据行业组织欧洲天然气基础设施的数据，欧盟的天然气储能水平为93.6%，略高于5年平均水平，但低于去年的水平。风力发电的减少也支撑了天然气价格，这提高了一些欧洲国家的天然气需求。,EUR,,2024-11-11 09:49:23,20241112
,2024-11-11 18:15:33,格隆汇11月11日｜欧洲天然气价格跃升3.2%，至每兆瓦时43.77欧元，创下2024年新高。,EUR,,2024-11-11 10:15:33,20241112
美银：避险资金减少和降息可能打压瑞郎,2024-11-11 20:59:51,格隆汇11月11日丨美国银行在一份报告中表示，由于避险需求减少以及瑞士央行进一步降息，瑞郎可能下跌。美国银行外汇策略师Kamal Sharma称，随着美国总统大选这一重大事件的风险消失，流向瑞郎的避险资金可能会减少。他表示，鉴于瑞士的通胀进程没有出现问题，瑞士央行可能会在每次会议上降息，直到政策利率达到0.5%。然而，德国日益加剧的政治担忧意味着欧元兑瑞郎“可能会屈服于6月份出现的那种压力”。他表示，抛售瑞郎兑美元和英镑等其他货币的理由更令人信服。,EUR,,2024-11-11 12:59:51,20241112
离岸人民币跌破“7.20”关口后 外汇市场出现“抄底”买盘,2024-11-11 21:06:06,格隆汇11月11日｜据每经，今日20时，离岸人民币兑美元汇率跌破“7.20”关口，报价为7.219。东方金诚首席宏观分析师王青认为，受9月底美联储主席鲍威尔表示“降息将循序渐进”等因素影响，近期美债收益率大幅走高；与此同时，市场对欧洲央行降息预期持续升温，日本政府则表示“目前没有进一步加息的环境”。在这些因素综合作用下，10月份以来美元对欧元、日元升值，带动美元指数显著上行，令人民币汇率承受一定程度的被动下跌压力。不过，一位香港银行外汇交易员告诉记者，当日离岸人民币跌破7.21整数关口后，外汇市场一度出现抄底买盘，若不是强势美元令离岸人民币汇率承压，后者理应存在较高概率收复“7.20”关口。短期而言，人民币汇率仍将受美元强势反弹影响而承压，但就中长期而言，随着美联储仍会继续降息，加之中国经济基本面向好，众多海外投资机构仍然相信人民币汇率有望回升并收复“7”整数关口。,EUR,,2024-11-11 13:06:06,20241112
美元指数涨0.5%，创逾四个月新高,2024-11-12 06:24:22,"格隆汇11月12日｜周一（11月11日）纽约尾盘，ICE美元指数上涨0.49%，报105.512点，北京时间15:00打破亚太时段于105点一线的窄幅横盘整理状态，并持续走高，日内交投区间为104.934-105.705点，北京时间22:51逼近7月2日顶部106.054点和6月26日顶部106.130点。彭博美元指数涨0.50%，报1274.06点，日内交投区间为1267.17-1276.43点。
美元兑日元涨0.70%，报153.71日元，全天处于持续震荡上行的状态，日内交投区间为152.64-153.95日元。欧元兑美元跌0.60%、报1.0654，英镑兑美元跌0.40%、报1.2870，美元兑瑞郎涨0.55%、报0.8805。商品货币对中，澳元兑美元跌0.12%，纽元兑美元跌0.07%，美元兑加元涨0.10%。瑞典克朗兑美元跌0.30%，挪威克朗兑美元跌0.42%。",EUR,,2024-11-11 22:24:22,20241112
