title,updateTimestamp,content,relatedStocks,relatedInfos,date,trade_date
受法国政治风险影响 美元兑新元走强,2024-12-03 11:09:09,格隆汇12月3日｜美元兑新元在亚洲交易时段走强，因法国的政治风险似乎正推动资金从欧元流向美元。马来亚银行分析师在一份外汇研究与策略报告中称，法国总理巴尼耶迫使议会未经表决通过了一项社会保障法案。分析人士说，这可能导致不信任动议，从而导致政府垮台。“政治动荡的关键暗示是，法国政府的赤字将会上升，法国将不得不支付更多的钱来填补赤字。”他们补充说。,EUR,,2024-12-03 03:09:09,20241204
荷兰国际：法国政治动荡或限制欧元涨幅,2024-12-03 16:53:41,格隆汇12月3日｜荷兰国际分析师Chris Turner表示，如果美国稍晚时候公布的职位空缺和劳动力流动率调查结果弱于预期，欧元可能会小幅回升，不过法国的政治动荡可能会限制涨幅。美国10月职位空缺数据若逊于预期，将提振对美联储降息的预期，并打压美元。不过，欧元/美元的任何上涨都可能局限于1.0550区域。对于法德债券利差和法国主权信用违约互换的上升，欧元可能会做出越来越负面的反应。,EUR,,2024-12-03 08:53:41,20241204
美元指数在韩国“宵禁”闹剧之夜下跌，日元一度涨穿149,2024-12-04 06:33:18,"格隆汇12月4日｜ 周二（12月3日）纽约尾盘，ICE美元指数下跌0.11%，报106.325点，日内交投区间为106.602-106.087点，韩国总统尹锡悦突发宣布“戒严令”之后，在北京时间22:38（美股盘初）跌穿106.100，02:00之后又多次跌穿这一水平。美元兑日元持平，报149.59日元，13:03刷新日高至150.24日元，20:30之前开始出现一波显著的下挫+转跌，22:41刷新日低至148.65日元。
欧元兑日元涨0.09%，报157.19日元，23:30曾跌至156.18日元；英镑兑日元涨0.17%，报189.642日元，23:30也曾跌至188.092日元。彭博美元指数大致持平，报1281.21点，日内交投区间为1283.50-1278.87点。欧元兑美元涨0.11%报1.0510、02:04刷新日高至1.0535，英镑兑美元涨0.14%、报1.2673，美元兑瑞郎大致持平、报0.8864；商品货币对中，澳元兑美元涨0.18%，纽元兑美元跌0.11%，美元兑加元涨0.16%。瑞典克朗兑美元跌0.20%，挪威克朗兑美元涨0.33%。",EUR,,2024-12-03 22:33:18,20241204
路透调查：欧元短期内料持续疲软，但暂时不会跌至齐平美元,2024-12-04 08:11:26,格隆汇12月4日｜据路透对市场策略师的调查发现，欧元短期内仍将保持疲软态势，因一方面受法国政治动荡加剧拖累，而美国明年初预计将实施的新关税，则正在提升美元的吸引力。尽管欧元短期内几乎无望反弹，但大多数策略师仍然相信欧元未来三个月内不会跌至与美元平价，主要是因为许多利空已经被消化。欧元兑美元EUR/USD目前交投在1.05附近，在12月2日至3日对近70位货币策略师进行的调查显示，预测三个月后欧元兑美元将维持在这一水平，六个月后将下跌约1%至1.04，明显低于11月调查预测的1.10和1.11。,EUR,,2024-12-04 00:11:26,20241204
