title,updateTimestamp,content,relatedStocks,relatedInfos,date,trade_date
欧元兑美元创阶段新低,2024-11-14 09:43:16,格隆汇11月14日｜欧元兑美元EUR/USD跌至2023年11月以来的最低点，报1.0551。,EUR,,2024-11-14 01:43:16,20241115
欧元/美元自去年10月以来首次跌破1.05,2024-11-14 19:17:08,格隆汇11月14日｜欧元兑美元EUR/USD一度向下触及1.05，为2023年10月以来首次，日内跌0.61%。,EUR,,2024-11-14 11:17:08,20241115
美元指数短线涨幅扩大,2024-11-14 21:38:45,格隆汇11月14日｜美元指数DXY短线涨幅扩大至近30点，现报106.95；英镑兑美元GBP/USD、欧元兑美元EUR/USD短线下挫约30点。,EUR,,2024-11-14 13:38:45,20241115
美元指数在鲍威尔讲话日涨0.4%，日元跌穿156,2024-11-15 06:26:25,"格隆汇11月15日｜周四（11月14日）纽约尾盘，ICE美元指数上涨0.39%，报106.901点，日内大起大落，北京时间19:14涨至107.064点——为2023年11月1日以来首次涨穿107点关口（当天顶部107.113点），随后转而在00:26刷新日低至106.382点，美联储主席鲍威尔讲话后涨幅显著扩大。彭博美元指数涨0.27%，报1288.18点，日内交投区间为1283.52-1290.02点。
美元兑日元涨0.53%，报156.28日元，日内交投区间为155.35-156.42日元。欧元兑美元跌0.32%报1.0530——一度跌穿1.05关口为2023年10月13日以来首次，英镑兑美元跌0.30%，美元兑瑞郎涨0.52%；商品货币对中，澳元兑美元跌0.55%，纽元兑美元跌0.52%，美元兑加元涨0.43%。瑞典克朗兑美元跌0.11%，挪威克朗兑美元跌0.12%。",EUR,,2024-11-14 22:26:25,20241115
