title,updateTimestamp,content,relatedStocks,relatedInfos,date,trade_date
瑞银：瑞典央行降息或促瑞典克朗未来几个季度逐步回升,2024-11-18 19:41:22,格隆汇11月18日｜瑞银全球财富管理公司在一份报告中表示，随着瑞典央行的一系列降息举措应会提振瑞典经济，瑞典克朗在未来几个季度可能会逐步回升。瑞银策略师克莱芒丝・迪蒙塞尔称：“我们预计欧洲央行在2025年年中之前的每次会议上都会采取宽松政策，这将使瑞典央行也能快速降息，进而进一步支撑瑞典经济。”她还表示，如果随着美国经济放缓，市场将更多美国降息预期纳入定价之中，瑞典克朗也可能获得支撑。不过，美国当选总统唐纳德・特朗普治下爆发贸易战的风险可能会限制瑞典克朗的回升幅度。瑞银预计，到2025年6月，欧元兑瑞典克朗汇率将从目前的11.6043降至11.30。,EUR,,2024-11-18 11:41:22,20241119
美元指数跌超0.4%,2024-11-19 07:00:59,"格隆汇11月19日｜周一（11月18日）纽约尾盘，ICE美元指数下跌0.45%，报106.211点，日内交投区间为106.813-106.131点，11月14日涨至107.064点之后，连续两个交易日回调。彭博美元指数跌0.42%，报1280.33点，日内交投区间为1286.83-1279.15点。
美元兑日元涨0.23%，报154.66日元，日内交投区间为153.84-155.36日元。欧元兑美元涨0.55%、报1.0598，英镑兑美元涨0.49%、报1.2679，美元兑瑞郎跌0.47%、报0.8834；商品货币对中，澳元兑美元涨0.68%，纽元兑美元涨0.45%，美元兑加元跌0.51%。瑞典克朗兑美元涨0.56%，挪威克朗兑美元涨0.72%。",EUR,,2024-11-18 23:00:59,20241119
道明证券：预计欧/美将跌至1.01，勉强避免平价,2024-11-19 08:22:45,格隆汇11月19日｜道明证券表示，预计特朗普的关税政策将对欧元区经济产生重大影响，且不会是积极影响。而欧元区的增长引擎有限，且经济政策的不确定性在整个欧洲居高不下。此外，预计欧洲央行的降息幅度将超过美联储，市场的定价可能会进一步反映出欧元区和美国之间的货币政策分歧。预计到2025年第二季度，欧元兑美元汇率将为1.01。,EUR,,2024-11-19 00:22:45,20241119
美国银行：英镑明年走强存在三个理由,2024-11-19 08:24:39,格隆汇11月19日｜美国银行表示，英镑有望在2025年上涨。该机构援引了三个理由：首先，英国不太可能成为特朗普贸易关税计划的焦点；其次，英国对服务业的依赖也将在一定程度上保护自己免受关税的影响；第三，在工党政府的领导下，英国脱欧的发展方向不那么充满敌意。不过，美国银行也指出，它不寻求英镑会有即时持续的上涨，美国大选后美元走强仍是近期的限制性因素。但在欧元区政治和财政动荡的背景下，欧元兑英镑可能在2025年下跌。,EUR,,2024-11-19 00:24:39,20241119
