title,updateTimestamp,content,relatedStocks,relatedInfos,date,trade_date
美国总统选战最后阶段 美元指数偏软,2024-11-04 09:27:20,"格隆汇11月4日｜美国总统选举进入最后48小时倒数，美元指数在亚洲时段开始时偏软。
美元指数跌0.5%至103.7934。欧元兑美元升0.5%至1.0887，美元兑日元跌0.7%至151.85。
两名美国总统候选人，特朗普与哈里斯在选前最后一个星期日，集中在7个摇摆州份拉票。民调显示，两人的支持度仍很接近。
Pepperstone分析员Chris Weston指出，有民调称哈里斯在传统上属共和党州份的艾奥瓦州领先特朗普，可能是美元偏软原因之一。",EUR,,2024-11-04 01:27:20,20241105
日元早盘走强 套利交易面临重大风险,2024-11-04 10:48:43,格隆汇11月4日｜由于隐含波动率高，日元兑其他10国集团货币和亚洲货币在早盘走强。加拿大皇家银行资本市场的Alvin T. Tan表示：“各个市场的隐含波动率都很高。恐慌指数VIX周五收在21上方，而欧元/美元一个月隐含波动率在8上方，美元/日元在13上方。他指出，由于市场剧烈波动，套利交易通常容易受到重大风险的影响。套利交易是指投资者借入日元等低收益货币，投资于高收益货币。,EUR,,2024-11-04 02:48:43,20241105
,2024-11-04 11:27:37,格隆汇11月4日｜欧元兑美元EUR/USD站上1.09，日内涨0.61%；英镑兑美元GBP/USD日内涨幅扩大至0.50%，现报1.2992。,EUR,,2024-11-04 03:27:37,20241105
美银：对英镑持乐观态度，预计年底前将走强,2024-11-04 15:01:28,格隆汇11月4日丨 美国银行外汇分析师Kamal Sharma表示，外汇市场正努力应对英国国债收益率上升的背景下如何交易英镑的问题。 预算案并未得到债券市场的积极回应。英国国债收益率上升，2年期收益率几乎上涨20个基点，10年期收益率上涨15个基点。分析师警告，这可能表明财政大臣高估了市场对吸纳更多英国主权债务发行的需求。 Sharma提到：“尽管财政刺激力度超过预期，迫使市场重新评估英国央行的宽松前景，我们并不轻视债务发行的数量，但我们认为当前条件不足以使其成为影响英镑的实质性驱动力”。 因此，美国银行继续对英镑持乐观态度，预计年底前欧元兑英镑将走弱，英镑兑瑞郎将有所上涨。,EUR,,2024-11-04 07:01:28,20241105
,2024-11-04 17:48:50,格隆汇11月4日｜欧元兑美元一周隐含期权波动率达到12.44%，为2023年3月以来最高水平。,EUR,,2024-11-04 09:48:50,20241105
彭博美元指数在美国大选前一天跌超0.4%，日元涨超0.5%逼近151,2024-11-05 06:28:43,"格隆汇11月5日｜周一（11月4日，上周五发布了美国非农就业报告）纽约尾盘，ICE美元指数下跌0.36%，报103.905点，全天处于下跌状态，日内交投区间为103.960-103.576点，最近两个交易日下探200日均线（该技术指标暂报103.839点）。彭博美元指数跌0.42%，报1258.55点，日内交投区间为1259.22-1254.85点。
美元兑日元跌0.56%，报152.15日元，日内交投区间为152.63-151.54日元。欧元兑美元涨0.40%、报1.0877，英镑兑美元涨0.25%、报1.2957，美元兑瑞郎跌0.66%；商品货币对中，澳元兑美元涨0.38%，纽元兑美元涨0.15%，美元兑加元跌0.33%。瑞典克朗兑美元涨0.19%，挪威克朗兑美元涨0.55%。",EUR,,2024-11-04 22:28:43,20241105
