title,updateTimestamp,content,relatedStocks,relatedInfos,date,trade_date
人民币9月国际支付占比下滑至3.61%，为2023年10月以来最低,2024-11-01 11:03:31,"格隆汇11月1日｜全球金融信息服务机构(SWIFT)数据显示，9月人民币在全球支付中的占比从4.69%下滑至3.61%，排名回落至第5，为2023年10月以来的最低水平；降幅1.08个百分点，为数据记录以来最大降幅。
瑞穗银行分析认为，前段时间人民币升值导致中国企业更愿意使用自有美元结算，或为人民币支付减少的一个原因。
日元9月份国际支付份额为4.27%，环比增0.29个百分点；美元继续排第一，国际支付份额为47.01%，环比跌2.06个百分点；欧元占22.56%，环比增0.98个百分点；英镑占7.41%，环比增0.91个百分点。
SWIFT指出，9月份人民币整体支付金额环比跌23.55%，所有货币计支付总额环比跌0.67%。",EUR,,2024-11-01 03:03:31,20241102
荷兰国际：欧元兑美元短期内受到支撑,2024-11-01 14:50:25,格隆汇11月1日｜荷兰国际表示，欧元兑美元短期内可能会继续得到支撑。包括德国CPI在内的欧元区数据意外上扬，为该货币对提供支撑，因欧洲央行的鹰派情绪增强。欧洲央行执委施纳贝尔建议不要仓促降息，导致欧洲央行最终利率预期上调12个基点。欧元区10月CPI初值也意外高于预期，可能进一步缓和12月降息的预期。,EUR,,2024-11-01 06:50:25,20241102
机构：英国秋季预算公布后 英镑大跌后企稳,2024-11-01 19:38:07,格隆汇11月1日｜英镑兑美元前一交易日跌至两个半月低点，英镑兑欧元跌至六周低点后企稳。周三，英国工党政府公布了包括增税和增加借贷在内的预算报告，英镑随之下跌。Ebury的Matthew Ryan在一份报告中表示，市场显然担心，工党的大规模借贷计划将推高债券发行，使利率在更长时间内保持在较高水平，从而推高抵押贷款利率，拖累英国经济增长。,EUR,,2024-11-01 11:38:07,20241102
巴克莱：由于预算引发对英国资产的抛售 交易员开始做空英镑,2024-11-01 20:04:44,格隆汇11月1日｜据巴克莱银行的数据，在英国预算引发英国资产抛售后，投资者现在持有的英镑空头头寸多于多头头寸。巴克莱全球货币分销主管Mimi Rushton表示，部分对冲基金和资产管理公司正在增加英镑空头头寸，以回应周三公布的秋季预算。鉴于美国大选临近，这种风险相当小。周三，英国英国预算责任办公室宣布本财政年度政府债券销售额为2970亿英镑，超过了16家债券交易商估计的2930亿英镑。Rushton表示，鉴于未来债务方面的回旋余地缩小，需要重新定价，市场将继续关注市场人气。此外，考虑到利差，英镑兑欧元走强的理由仍然存在。,EUR,,2024-11-01 12:04:44,20241102
美元指数跳水 非美货币走高,2024-11-01 20:33:04,格隆汇11月1日｜美国10月非农数据公布后，美元指数跳水，报103.8。欧元兑美元EUR/USD短线走高逾30点，英镑兑美元GBP/USD短线走高逾40点，美元兑日元USD/JPY近80点。,EUR,,2024-11-01 12:33:04,20241102
美元短线跳水 美国就业增长超预期放缓,2024-11-01 20:58:54,格隆汇11月1日｜美元周五回吐早盘涨幅，兑欧元走低，此前数据显示，受飓风和波音公司工人罢工影响，美国10月就业增长大幅放缓。周五公布的数据显示，10月非农就业人口增长1.2万人。路透调查的经济学家此前预计，美国就业人数将增加11.3万人。欧元兑美元一度触及两周多高点，最新上涨约0.12%，美元指数DXY下跌约0.14%，至103.72附近。,EUR,,2024-11-01 12:58:54,20241102
美元指数在“非农日”V型反转，日元本周跌超0.4%,2024-11-02 06:34:24,"格隆汇11月2日｜周五（11月1日）纽约尾盘，ICE美元指数上涨0.33%，报104.317点，北京时间20:30发布美国非农就业报告后跳水、刷新10月21日以来低点至103.679点，随后收复失地并逐步走高，本周累涨0.06%。彭博美元指数涨0.40%，报1263.87点，20:40也刷新日低至1256.11点，随后反弹，本周累涨0.19%。
美元兑日元涨0.62%，报152.98日元，本周累涨0.43%。欧元兑美元跌0.46%、报1.0834，本周累涨0.36%，期内持续震荡上行，非农后一度涨至1.0905；英镑兑美元涨0.16%、报1.2920基本回吐非农就业报告之后出现的涨幅，本周累跌0.31%；美元兑瑞郎涨0.74%、报0.8698，本周累涨0.37%。商品货币对中，澳元兑美元跌0.34%、本周累跌0.66%，纽元兑美元跌0.23%、本周累跌0.22%，美元兑加元涨0.13%、本周累涨0.44%。瑞典克朗兑美元跌0.90%、本周累跌1.13%，挪威克朗兑美元跌0.60%、本周累跌0.77%。",EUR,,2024-11-01 22:34:24,20241102
