title,updateTimestamp,content,relatedStocks,relatedInfos,date,trade_date
荷兰国际银行：英镑兑欧元本周可能进一步上涨,2024-09-30 16:00:57,格隆汇9月30日｜荷兰国际集团说，数据显示，英国第二季度国内生产总值环比增幅被略微下调至0.5%，英镑对此不为所动，如果英国没有即将公布的重大经济数据，英镑兑欧元可能在未来几天进一步走强。周二公布的欧元区通胀数据可能会巩固欧洲央行10月份降息25个基点的预期，这可能会使欧元兑英镑跌破0.83。他说：“在10月15日之前，英国不会有重要的就业数据发布，只有英国央行决策者小组调查的部分数据例外。”,EUR,,2024-09-30 08:00:57,20241001
,2024-09-30 16:57:10,格隆汇9月30日｜欧元兑美元突破1.12，日内涨0.37%。,EUR,,2024-09-30 08:57:10,20241001
,2024-09-30 23:38:50,格隆汇9月30日｜欧元兑英镑日内跌0.4%至0.8314，为2022年4月来最低水平。,EUR,,2024-09-30 15:38:50,20241001
美元指数9月份累跌超0.9%，日元涨超1.7%一度突破140,2024-10-01 06:33:29,"格隆汇10月1日｜周一（9月30日）纽约尾盘，ICE美元指数上涨0.38%，报100.761点，9月份累计下跌0.92%，月内绝大部分时间处于下跌状态，9月27日北京时间20:30一度跌至100.157点。美元兑日元上涨0.98%，报143.60日元，9月份累跌1.72%，月内绝大部分时间处于下跌状态，9月16日曾跌至139.58日元。彭博美元指数涨0.30%，报1222.81点，9月份累跌0.93%，9月25日08:00曾跌至1216.47点。
欧元兑日元涨0.72%，报159.89日元，9月份累跌0.98%；英镑兑日元涨0.97%，报192.075日元，9月份累涨0.11%呈现出V型反转。欧元兑美元跌0.23%、9月份累涨0.82%，英镑兑美元大致持平、9月份累涨1.89%，美元兑瑞郎涨0.63%、9月份累跌0.49%；商品货币对中，澳元兑美元涨0.17%、9月份累涨2.22%，纽元兑美元涨0.08%、9月份累涨1.60%，美元兑加元涨0.08%、9月份累涨0.26%。瑞典克朗兑美元涨0.63%、9月份累跌1.10%，挪威克朗兑美元涨0.45%、9月份累跌0.62%。",EUR,,2024-09-30 22:33:29,20241001
