title,updateTimestamp,content,relatedStocks,relatedInfos,date,trade_date
欧元兑美元涨1.2%,2025-01-20 21:43:20,格隆汇1月20日｜欧元/美元延续涨势，上涨1.2%，触及日内高点1.0398。,EUR,,2025-01-20 13:43:20,20250121
美元指数跌破108 非美货币继续走高,2025-01-20 22:45:24,"格隆汇1月20日｜美元指数跌破108，日内跌1.30%。非美货币继续走高，美元兑日元USD/JPY日内跌超0.50%，现报155.48。美元兑加元USD/CAD失守1.43，日内跌幅1.27%。欧元兑美元EUR/USD和澳元兑美元AUD/USD日内涨幅均扩大至1.50%。
特朗普的官员证实了华尔街日报的报道，即他在上任第一天不会实施新关税。",EUR,['美元'],2025-01-20 14:45:24,20250121
美元指数大跌超1.2%，非美货币普遍走高,2025-01-21 06:21:18,格隆汇1月21日｜周一（1月20日）纽约尾盘，ICE美元指数下跌1.26%，报107.970点。彭博美元指数跌1.11%，报1301.60点。美元兑日元下跌0.49%，报155.53日元。欧元兑日元涨0.98%，报162.12日元；英镑兑日元涨0.88%，报191.873日元。欧元兑美元涨1.45%、报1.0434，英镑兑美元涨1.34%、报1.2332，美元兑瑞郎跌0.93%报0.9065，澳元兑美元涨1.33%，纽元兑美元涨1.64%，美元兑加元跌1.23%。瑞典克朗兑美元涨1.58%，挪威克朗兑美元涨1.37%。,EUR,,2025-01-20 22:21:18,20250121
,2025-01-21 08:56:38,格隆汇1月21日｜美元兑日元USD/JPY向上触及156，涨0.24%。欧元兑美元EUR/USD跌超0.50%，报1.0364。,EUR,,2025-01-21 00:56:38,20250121
