title,updateTimestamp,content,relatedStocks,relatedInfos,date,trade_date
,2024-08-14 16:03:22,格隆汇8月14日｜欧元/日元上涨0.5%至162.25，接近两周高点。,EUR,,2024-08-14 08:03:22,20240815
欧元兑美元触及1月以来最高水平 美国CPI数据发布在即,2024-08-14 16:49:07,格隆汇8月14日｜在关键的美国通胀数据公布前，欧元兑美元升至1月以来的最高水平。欧元/美元上涨0.2%，至1.1009，为1月2日以来的最高水平。随着市场加大对美联储政策宽松的押注，欧元兑美元自本月初以来已上涨2%。,EUR,,2024-08-14 08:49:07,20240815
欧元直逼年内高点 因美联储可能先于欧洲央行降息？,2024-08-14 17:48:40,格隆汇8月14日｜由于预期美联储在未来几个月将比欧洲央行更大幅度地降息，欧元兑美元汇率缓慢逼近今年的最高水平。目前欧元兑美元日内上涨约0.3%，至1.1027附近，市场等待美国通胀数据，以进一步证明美联储可能在下个月开始放松政策。货币市场目前的走势显示，美国到12月前可能降息超过100个基点，而欧元区的降息幅度为70个基点。尽管欧洲央行已在6月降息25个基点，但交易员认为，美联储最终有可能采取更激进的宽松政策，可能在9月降息50个基点。,EUR,,2024-08-14 09:48:40,20240815
美国CPI数据公布前，欧元攀升至七个月高点,2024-08-14 20:28:00,格隆汇8月14日｜欧元兑美元周三触及七个月高位，日内涨0.3%，超过上周市场动荡期间触及的高位，并在1月2日以来的最高水平交投。德国商业银行外汇分析师Volkmar Baur表示，交易商正在为CPI数据走弱做准备，这当然会带来一种风险，即如果CPI数据与意外上行一致，美元将再次走强。如果其出乎意料地下行，便不会使美联储朝着降息50个基点的方向摇摆，因为通胀是一个滞后指标，而略微疲软的CPI不会是即将衰退的信号。,EUR,,2024-08-14 12:28:00,20240815
,2024-08-14 20:36:07,格隆汇8月14日｜非美货币普跌，欧元兑美元EUR/USD短线下挫30点，报1.1016；英镑兑美元GBP/USD短线下挫超30点点，报1.2833。,EUR,,2024-08-14 12:36:07,20240815
美元指数在美国CPI发布日V型反转，日元跌穿147,2024-08-15 06:35:37,"格隆汇8月15日｜周三（8月14日）纽约尾盘，ICE美元指数涨0.03%，报102.593点，北京时间14:00刷新日高至102.720点，随后震荡下行，20:30发布美国CPI数据后从102.4点下方反弹至接近102.6点的水平，22:40刷新日低至102.270点，全天呈现出V型反转。彭博美元指数跌0.06%，报1241.61点，日内交投区间为1243.09-1238.70点。
亚洲货币中，美元兑日元涨0.32%，报147.25日元，北京时间10:36刷新日低至146.08日元，美国CPI数据发布后刷新日高至147.58日元。欧元兑日元涨0.48%，报162.19日元；英镑兑日元大致持平，报188.914日元。欧元兑美元涨0.18%，英镑兑美元跌0.23%，美元兑瑞郎涨0.06%；商品货币对中，澳元兑美元跌0.50%，纽元兑美元1.25%，美元兑加元涨0.08%。",EUR,,2024-08-14 22:35:37,20240815
