title,updateTimestamp,content,relatedStocks,relatedInfos,date,trade_date
,2024-09-13 09:04:01,格隆汇9月13日｜美元兑日元USD/JPY日内跌0.5%，报141.09。,JPY,,2024-09-13 01:04:01,20240914
美元兑日元跌破141,2024-09-13 10:23:56,格隆汇9月13日｜美元兑日元USD/JPY跌破141，日内跌0.57%。,JPY,,2024-09-13 02:23:56,20240914
,2024-09-13 12:38:54,格隆汇9月13日｜美元兑日元最新跌0.81%报140.65，触及2023年12月28日以来低点。,JPY,,2024-09-13 04:38:54,20240914
,2024-09-13 12:50:12,格隆汇9月13日｜日元兑美元汇率一度触及140.60附近，为去年12月下旬以来的最高水平。,JPY,,2024-09-13 04:50:12,20240914
对冲基金据报押注日元进一步升值,2024-09-13 13:20:44,"格隆汇9月13日｜据彭博，一些对冲基金在选择权市场上增加看涨日元的押注，他们预期日元将延续升势。一位交易员称，对冲基金对日元兑澳元、瑞士法郎和离岸人民币等货币持有多头头寸。
迹象显示，日本央行有意进一步加息，助日元兑美元自6月底以来上升约14%。美联储可能减息及日元空头部位的迅速平仓也有助于此。
继美联储可能在下周周中减息后，日本央行将在下周五发布政策决定。日本央行一些审议委员的最新评论显示，在7月政策利率上调至0.25%后，日本未来仍可能升息。
荷兰合作银行驻伦敦外滙策略主管Jane Foley表示，假设日本央行不排除年底左右再次加息的可能性，美元兑日元在未来3-6个月将继续向140移动。其他策略师预计，美元兑日元汇率到年底仍将下跌，甚至可能触及135。",JPY,,2024-09-13 05:20:44,20240914
,2024-09-13 17:40:51,格隆汇9月13日｜美元兑日元USD/JPY日内跌超1%，现报140.38。,JPY,,2024-09-13 09:40:51,20240914
彭博美元指数周五跌超0.3%，本周累跌约0.5%,2024-09-14 06:21:40,"格隆汇9月14日｜周五（9月13日）纽约尾盘，ICE美元指数下跌0.25%，报101.114点，北京时间21:12刷新日低至100.883点，日内整体呈现出V型走势、全天处于下跌状态，本周累计下跌0.06%，9月12日曾涨至101.839点。彭博美元指数跌0.31%，报1226.11点，22:44刷新日低至1224.66点，日内整体呈现出震荡下行走势，本周累跌0.47%，期内交投区间为1238.02-1224.66点。
美元兑日元跌0.70%，报140.82日元，北京时间22:00曾跌至140.29日元，本周累计下跌1.07%，整体呈现出震荡下行走势、交投区间为143.80-140.29日元。欧元兑日元跌0.70%，报155.98日元，本周累跌1.14%；英镑兑日元跌0.71%，报184.837日元，本周累跌1.06%。",JPY,,2024-09-13 22:21:40,20240914
