title,updateTimestamp,content,relatedStocks,relatedInfos,date,trade_date
,2024-09-20 10:53:49,格隆汇9月20日｜日本央行如期维持利率不变，美元兑日元USD/JPY短线拉升约30点后回落，现报142.53。,JPY,,2024-09-20 02:53:49,20240921
,2024-09-20 11:08:46,格隆汇9月20日｜美元兑日元USD/JPY短线走低50点，跌破142，日内跌0.46%。,JPY,,2024-09-20 03:08:46,20240921
日本央行表态乐观 日元收复失地,2024-09-20 11:25:45,格隆汇9月20日｜日元周五收复失地，美元兑日元USD/JPY一度跌至142下方，因日本央行对经济增长持乐观态度，并暗示将审慎地进一步收紧政策，而美元则面临压力，因市场预期美国将更快降息。澳洲联邦银行（CBA）外汇策略师Samara Hammoud指出，日本实际利率仍为负值，约为-2.5%，而日本央行预计中性利率在-1%至0.5%之间。“因此，在保持金融环境宽松的同时，还有进一步提高政策利率的空间，”她表示。“我们的基本预测仍然是，日本央行将在10月再次加息25个基点，尽管风险倾向于晚些时候加息。”“最近的金融市场动荡和即将到来的自民党选举可能会使日本央行在加息方面更加谨慎。”日本央行的政策声明有时可能相当不透明，因此投资者将关注日本央行行长植田和男在会后新闻发布会上对紧缩时间和步伐的暗示。,JPY,,2024-09-20 03:25:45,20240921
瑞穗证券：日本央行行长植田和男料持谨慎鹰派立场,2024-09-20 12:07:53,格隆汇9月20日｜现在焦点转向北京时间14:30的日本央行行长植田和男新闻发布会。瑞穗证券首席日本策略师Shoki Omori表示，植田和男可能会采取谨慎的鹰派语气，而不是上次政策会议上的“极端鹰派”姿态，以避免扰乱市场。Omori表示：“他将进行谨慎的沟通，以纳入12月或明年1月的加息。”“如果鹰派立场明确传达给市场，预计美元兑日元汇率将呈下行趋势。”,JPY,,2024-09-20 04:07:53,20240921
瑞穗证券：日元可能成为影响日本央行政策决定的更大因素,2024-09-20 13:21:22,格隆汇9月20日｜瑞穗证券经济学家Yusuke Matsuo称，日元走势可能已成为日本央行决策过程中一个更重要的因素。他指出，日本央行最近的声明称，汇率走势对物价的影响往往比过去更大。Matsuo在一份研究报告中表示：“即使（经济和价格）保持在正常轨道上，预计日本央行也将在10月份的会议上再次维持政策利率不变，以更仔细地审视金融市场、美国和其他海外经济体的趋势。”,JPY,,2024-09-20 05:21:22,20240921
,2024-09-20 18:41:27,格隆汇9月20日｜美元兑日元涨幅扩大至1%，报144.06。,JPY,,2024-09-20 10:41:27,20240921
