title,updateTimestamp,content,relatedStocks,relatedInfos,date,trade_date
,2024-10-10 12:33:47,格隆汇10月10日｜美元/日元升至149.52，为8月2日以来的最高水平。,JPY,,2024-10-10 04:33:47,20241011
美元兑日元升至10周高点 分析师：美元正重拾主导,2024-10-10 13:50:40,格隆汇10月10日｜美元兑日元周四升至10周高点，原因是市场对美联储将更耐心地放宽政策越来越有信心。美元指数DXY在近两个月的高点附近徘徊，在上周意外强劲的就业数据公布后，交易员进一步降低了对美国今年降息的押注。Capital.com资深金融市场分析师Kyle Rodda表示，在近期一连串强劲就业数据的支撑下，“美国例外论”重燃。隔夜公布的美联储最新会议纪要证实了美联储对保持劳动力市场健康的重视。Rodda说：“美元正在重新夺回霸主地位，主要是因为美国经济持续表现出色。与此同时，美国CPI的意外上行可能迫使美联储怀疑其对通胀路径的信心。”,JPY,,2024-10-10 05:50:40,20241011
投资者备战美国CPI，抛售日元成为“最受欢迎的交易”,2024-10-10 15:27:55,格隆汇10月10日｜随着投资者准备迎接美国月度通胀数据，“卖出日元”正成为越来越流行的战斗口号。随着交易员减少了对美联储降息的押注，提振了美元和美国国债收益率，日本最大的几家银行几乎一致认为日元将继续走弱。日元进一步下跌的前景，正鼓励交易员重新建立看跌头寸。若美国通胀数据不佳，日元是最易被抛售的货币之一。“到目前为止，‘卖出日元’是最受欢迎的交易——套利交易仍适用于做空日元的对冲基金，”ATFX Global Markets驻悉尼首席分析师Nick Twidale称， “考虑到对美联储降息幅度的疑虑，目前投资者更容易偏向做空日元。”瑞穗证券、野村证券和三菱日联等机构表示，日元兑美元汇率有可能跌至150或更低水平，这加大了日本当局再次干预的威胁。日元在过去一个月里下跌了4.6%，这已令日本官员和日元交易员保持高度警惕。,JPY,,2024-10-10 07:27:55,20241011
美指维持跌势 非美货币普涨,2024-10-10 20:48:58,格隆汇10月10日｜非美货币普涨，欧元兑美元EUR/USD短线波幅达40点，现报1.0947；英镑兑美元GBP/USD短线波幅达60点，现报1.3078；美元兑日元USD/JPY短线波幅超100点，现报148.62。,JPY,,2024-10-10 12:48:58,20241011
美元指数在美国CPI发布日小幅下跌,2024-10-11 06:22:33,格隆汇10月11日｜周四（10月10日）纽约尾盘，ICE美元指数涨跌0.06%，报102.862点，日内交投区间为102.720-103.178点。彭博美元指数跌0.05%，报1243.84点，日内交投区间为1242.07-1246.87点。美元兑日元跌0.49%，报148.57日元，日内交投区间为149.55-148.30日元。欧元兑美元跌0.02%，英镑兑美元跌0.%9，美元兑瑞郎跌0.53%。商品货币对中，澳元兑美元涨0.33%，纽元兑美元涨0.49%，美元兑加元涨0.22%。,JPY,,2024-10-10 22:22:33,20241011
