title,updateTimestamp,content,relatedStocks,relatedInfos,date,trade_date
,2024-08-13 12:38:02,格隆汇8月13日｜美元/日元上涨0.33%，报147.70点。,JPY,,2024-08-13 04:38:02,20240814
美银调查：日元在上涨后仍被低估,2024-08-13 19:59:11,格隆汇8月13日｜美国银行对全球基金经理进行的最新调查显示，尽管日元兑美元最近大幅上涨，但多数投资者仍认为日元被低估了。调查显示，8月份仍有63%的投资者认为日元被低估，而7月份这一比例为72%。自上次调查以来，日元的涨势是由于普遍的避险情绪支持避险资产，以及日本央行决定在7月的会议上提高利率并发出进一步加息的信号所支撑的。,JPY,,2024-08-13 11:59:11,20240814
野村：中东局势紧张之际 日元走弱只是暂时性的,2024-08-13 21:43:32,格隆汇8月13日｜野村表示，日元再度走软的局面将是短暂的，因为波动率高企、地缘政治局势紧张和避险买盘都给其带来支撑。野村策略师Yujiro Goto、Yusuke Miyairi和Jin Moteki在周二的报告中写道，日元和瑞士法郎周一回落“表明投资者越来越愿意再次建仓日元套利交易”。分析师指出，日元疲软可能会止步于1美元兑150日元左右的水平。,JPY,,2024-08-13 13:43:32,20240814
日元和美债价格双双走高,2024-08-13 22:12:15,"格隆汇8月13日｜日元兑美元转涨，刷新日高至146.85日元，投资者关注避险日元。
美国10年期国债收益率跌约5个基点，刷新日低至3.8465%，处于连续第三个交易日下跌之中。",JPY,,2024-08-13 14:12:15,20240814
ICE美元指数在美国CPI发布前跌约0.5%，日元涨穿147,2024-08-14 06:26:02,"格隆汇8月14日｜周二（8月13日）纽约尾盘，ICE美元指数下跌0.47%，报102.615点，日内交投区间为103.272-102.550点，北京时间17:06刷新日高，北京时间20:30发布的美国PPI数据提振市场对美联储降息前景的预期，美元旋即在日内开启持续的震荡下行走势。周三，美国CPI数据将出炉。彭博美元指数跌0.44%，报1242.36点，日内交投区间为1248.39-1241.76点。
亚洲货币中，美元兑日元跌0.24%，报146.85日元，日内交投区间为147.95-146.60日元，北京时间14:51（亚太尾盘）刷新日高后回落，20:30发布美国PPI数据后进一步走低。",JPY,,2024-08-13 22:26:02,20240814
日本散户所持日元多头头寸逼近历史最高位,2024-08-14 07:50:35,格隆汇8月14日｜彭博根据东京金融交易所汇编的数据显示，日本散户所持日元兑14种外币期货净多头头寸达到4310亿日元（折合29亿美元），逼近4月份所创历史最高位5010亿日元；自日本央行7月份加息以来，日元多头头寸累计增长22%。麦格里预计，日元兑美元到2025年年底可能会涨至125日元。,JPY,,2024-08-13 23:50:35,20240814
