title,updateTimestamp,content,relatedStocks,relatedInfos,date,trade_date
,2024-10-04 12:22:24,格隆汇10月4日｜美元/日元日内跌幅扩大至0.5%。,JPY,,2024-10-04 04:22:24,20241005
美元兑日元失守146,2024-10-04 13:50:09,格隆汇10月4日｜美元兑日元USD/JPY失守146，日内跌幅0.65%。,JPY,,2024-10-04 05:50:09,20241005
,2024-10-04 20:37:24,格隆汇10月4日｜美元兑日元USD/JPY日内涨超0.5%，现报147.72。,JPY,,2024-10-04 12:37:24,20241005
非美货币走低 美元兑日元涨1%,2024-10-04 20:55:11,格隆汇10月4日｜美元指数DXY日内涨超0.5%，现报102.48。美元兑日元USD/JPY涨幅扩大至1%，报148.43。澳元兑美元AUD/USD向下触及0.68，日内跌0.60%。美元兑瑞郎USD/CHF涨0.5%，现报0.8571。,JPY,,2024-10-04 12:55:11,20241005
,2024-10-05 00:38:37,格隆汇10月5日｜美元兑日元USD/JPY向上触及149，为8月中旬以来首次，日内涨1.39%。,JPY,,2024-10-04 16:38:37,20241005
美元指数在非农日涨约0.5%，日元跌1.2%本周累跌超4%,2024-10-05 06:30:50,"格隆汇10月5日｜周五（10月4日）纽约尾盘，ICE美元指数涨0.49%，报102.487点，北京时间20:30发布美国非农就业报告后，打破日内稍早窄幅震荡于102点下方的表现，从101.865点迅速拉升至102.400点上方，，本周累计上涨2.10%，期内交投区间为100.179-102.687点，整体震荡上行，涨幅在非农数据带动下陡然扩大。
彭博美元指数涨0.44%，报1238.30点，本周累涨1.57%。美元兑日元涨1.20%，报148.69日元，本周累计上涨4.51%。本周，欧元兑日元累涨2.78%，英镑兑日元累涨2.57%。欧元兑美元跌0.51%，报1.0975，本周累跌1.66%；英镑兑美元大致持平，报1.3123，本周累跌1.88%；美元兑瑞郎涨0.66%，本周累涨2.10%；商品货币对中，澳元兑美元累跌1.60%，纽元兑美元累跌2.89%，美元兑加元累涨0.44%。瑞典克朗兑美元累涨2.60%，挪威克朗兑美元累涨1.44%。土耳其里拉兑美元累涨0.24%，南非兰特兑美元累涨2.24%，墨西哥比索兑美元累跌2.09%，巴西雷亚尔兑美元累涨0.34%。",JPY,,2024-10-04 22:30:50,20241005
